{
  "schema_version": "gloamstead.sanctuary.inventory.v1",
  "document_sha256": "bf571186dc55117e3cc7cfc39074ff5da92b868f80f9b2163c2a19bc43fe7af4",
  "kit_id": "sanctuary-biome-kit",
  "version": "1.0.0",
  "pointer_value": "sanctuary-biome-kit-1.0.0",
  "source_root": "SourceArt/WorldForge/Accepted/Sanctuary/1.0.0",
  "unreal_root": "/Game/Gloamstead/Generated/Biomes/Sanctuary/1_0_0",
  "promotion_policy": "automatic_on_all_green",
  "deliverables": [
    {
      "id": "surface-ashen-soil",
      "family": "surfaces",
      "semantic_role": "Ashen soil",
      "art_purpose": "Grounds the sanctuary in ashen soil with authored PBR response",
      "asset_class": "MaterialInstance",
      "restoration_state": null,
      "source_path": "SourceArt/WorldForge/Accepted/Sanctuary/1.0.0/surfaces/surface_ashen_soil.sbs",
      "unreal_object_path": "/Game/Gloamstead/Generated/Biomes/Sanctuary/1_0_0/surfaces/surface_ashen_soil.surface_ashen_soil",
      "dependency_ids": [
        "master-surface",
        "texture-ashen-soil-base-color",
        "texture-ashen-soil-normal",
        "texture-ashen-soil-orm"
      ],
      "acceptance_tags": [
        "pbr",
        "surface",
        "tileable"
      ],
      "ownership": {
        "owner": "Gloamstead",
        "license": "Proprietary-Gloamstead"
      },
      "asset_family_lane": "surfaces",
      "production_spec": null
    },
    {
      "id": "surface-cracked-stone",
      "family": "surfaces",
      "semantic_role": "Cracked sanctuary stone",
      "art_purpose": "Grounds the sanctuary in cracked sanctuary stone with authored PBR response",
      "asset_class": "MaterialInstance",
      "restoration_state": null,
      "source_path": "SourceArt/WorldForge/Accepted/Sanctuary/1.0.0/surfaces/surface_cracked_stone.sbs",
      "unreal_object_path": "/Game/Gloamstead/Generated/Biomes/Sanctuary/1_0_0/surfaces/surface_cracked_stone.surface_cracked_stone",
      "dependency_ids": [
        "master-surface",
        "texture-cracked-stone-base-color",
        "texture-cracked-stone-normal",
        "texture-cracked-stone-orm"
      ],
      "acceptance_tags": [
        "pbr",
        "surface",
        "tileable"
      ],
      "ownership": {
        "owner": "Gloamstead",
        "license": "Proprietary-Gloamstead"
      },
      "asset_family_lane": "surfaces",
      "production_spec": null
    },
    {
      "id": "surface-withered-loam-moss",
      "family": "surfaces",
      "semantic_role": "Withered loam and moss",
      "art_purpose": "Grounds the sanctuary in withered loam and moss with authored PBR response",
      "asset_class": "MaterialInstance",
      "restoration_state": null,
      "source_path": "SourceArt/WorldForge/Accepted/Sanctuary/1.0.0/surfaces/surface_withered_loam_moss.sbs",
      "unreal_object_path": "/Game/Gloamstead/Generated/Biomes/Sanctuary/1_0_0/surfaces/surface_withered_loam_moss.surface_withered_loam_moss",
      "dependency_ids": [
        "master-surface",
        "texture-withered-loam-moss-base-color",
        "texture-withered-loam-moss-normal",
        "texture-withered-loam-moss-orm"
      ],
      "acceptance_tags": [
        "pbr",
        "surface",
        "tileable"
      ],
      "ownership": {
        "owner": "Gloamstead",
        "license": "Proprietary-Gloamstead"
      },
      "asset_family_lane": "surfaces",
      "production_spec": null
    },
    {
      "id": "mi-sanctuary-before",
      "family": "materials",
      "semantic_role": "before state material",
      "art_purpose": "Carries the caller-authored before restoration language",
      "asset_class": "MaterialInstance",
      "restoration_state": "before",
      "source_path": "SourceArt/WorldForge/Accepted/Sanctuary/1.0.0/materials/mi_sanctuary_before.json",
      "unreal_object_path": "/Game/Gloamstead/Generated/Biomes/Sanctuary/1_0_0/materials/mi_sanctuary_before.mi_sanctuary_before",
      "dependency_ids": [
        "surface-ashen-soil",
        "surface-cracked-stone",
        "surface-withered-loam-moss"
      ],
      "acceptance_tags": [
        "state-readability",
        "material-instance"
      ],
      "ownership": {
        "owner": "Gloamstead",
        "license": "Proprietary-Gloamstead"
      },
      "asset_family_lane": "hero-ritual",
      "production_spec": null
    },
    {
      "id": "mi-sanctuary-restoration_in_progress",
      "family": "materials",
      "semantic_role": "restoration_in_progress state material",
      "art_purpose": "Carries the caller-authored restoration_in_progress restoration language",
      "asset_class": "MaterialInstance",
      "restoration_state": "restoration_in_progress",
      "source_path": "SourceArt/WorldForge/Accepted/Sanctuary/1.0.0/materials/mi_sanctuary_restoration_in_progress.json",
      "unreal_object_path": "/Game/Gloamstead/Generated/Biomes/Sanctuary/1_0_0/materials/mi_sanctuary_restoration_in_progress.mi_sanctuary_restoration_in_progress",
      "dependency_ids": [
        "surface-ashen-soil",
        "surface-cracked-stone",
        "surface-withered-loam-moss"
      ],
      "acceptance_tags": [
        "state-readability",
        "material-instance"
      ],
      "ownership": {
        "owner": "Gloamstead",
        "license": "Proprietary-Gloamstead"
      },
      "asset_family_lane": "hero-ritual",
      "production_spec": null
    },
    {
      "id": "mi-sanctuary-restored",
      "family": "materials",
      "semantic_role": "restored state material",
      "art_purpose": "Carries the caller-authored restored restoration language",
      "asset_class": "MaterialInstance",
      "restoration_state": "restored",
      "source_path": "SourceArt/WorldForge/Accepted/Sanctuary/1.0.0/materials/mi_sanctuary_restored.json",
      "unreal_object_path": "/Game/Gloamstead/Generated/Biomes/Sanctuary/1_0_0/materials/mi_sanctuary_restored.mi_sanctuary_restored",
      "dependency_ids": [
        "surface-ashen-soil",
        "surface-cracked-stone",
        "surface-withered-loam-moss"
      ],
      "acceptance_tags": [
        "state-readability",
        "material-instance"
      ],
      "ownership": {
        "owner": "Gloamstead",
        "license": "Proprietary-Gloamstead"
      },
      "asset_family_lane": "hero-ritual",
      "production_spec": null
    },
    {
      "id": "mi-sanctuary-corrupted",
      "family": "materials",
      "semantic_role": "corrupted state material",
      "art_purpose": "Carries the caller-authored corrupted restoration language",
      "asset_class": "MaterialInstance",
      "restoration_state": "corrupted",
      "source_path": "SourceArt/WorldForge/Accepted/Sanctuary/1.0.0/materials/mi_sanctuary_corrupted.json",
      "unreal_object_path": "/Game/Gloamstead/Generated/Biomes/Sanctuary/1_0_0/materials/mi_sanctuary_corrupted.mi_sanctuary_corrupted",
      "dependency_ids": [
        "surface-ashen-soil",
        "surface-cracked-stone",
        "surface-withered-loam-moss"
      ],
      "acceptance_tags": [
        "state-readability",
        "material-instance"
      ],
      "ownership": {
        "owner": "Gloamstead",
        "license": "Proprietary-Gloamstead"
      },
      "asset_family_lane": "hero-ritual",
      "production_spec": null
    },
    {
      "id": "veil-heart-before",
      "family": "hero-ritual",
      "semantic_role": "Veil Heart before",
      "art_purpose": "Makes Veil Heart communicate the before sanctuary state",
      "asset_class": "StaticMesh",
      "restoration_state": "before",
      "source_path": "SourceArt/WorldForge/Accepted/Sanctuary/1.0.0/hero-ritual/veil_heart_before.fbx",
      "unreal_object_path": "/Game/Gloamstead/Generated/Biomes/Sanctuary/1_0_0/hero-ritual/veil_heart_before.veil_heart_before",
      "dependency_ids": [
        "mi-sanctuary-before"
      ],
      "acceptance_tags": [
        "hero-silhouette",
        "state-readability",
        "collision",
        "lod"
      ],
      "ownership": {
        "owner": "Gloamstead",
        "license": "Proprietary-Gloamstead"
      },
      "asset_family_lane": "hero-ritual",
      "production_spec": null
    },
    {
      "id": "veil-heart-restoration_in_progress",
      "family": "hero-ritual",
      "semantic_role": "Veil Heart restoration_in_progress",
      "art_purpose": "Makes Veil Heart communicate the restoration_in_progress sanctuary state",
      "asset_class": "StaticMesh",
      "restoration_state": "restoration_in_progress",
      "source_path": "SourceArt/WorldForge/Accepted/Sanctuary/1.0.0/hero-ritual/veil_heart_restoration_in_progress.fbx",
      "unreal_object_path": "/Game/Gloamstead/Generated/Biomes/Sanctuary/1_0_0/hero-ritual/veil_heart_restoration_in_progress.veil_heart_restoration_in_progress",
      "dependency_ids": [
        "mi-sanctuary-restoration_in_progress"
      ],
      "acceptance_tags": [
        "hero-silhouette",
        "state-readability",
        "collision",
        "lod"
      ],
      "ownership": {
        "owner": "Gloamstead",
        "license": "Proprietary-Gloamstead"
      },
      "asset_family_lane": "hero-ritual",
      "production_spec": null
    },
    {
      "id": "veil-heart-restored",
      "family": "hero-ritual",
      "semantic_role": "Veil Heart restored",
      "art_purpose": "Makes Veil Heart communicate the restored sanctuary state",
      "asset_class": "StaticMesh",
      "restoration_state": "restored",
      "source_path": "SourceArt/WorldForge/Accepted/Sanctuary/1.0.0/hero-ritual/veil_heart_restored.fbx",
      "unreal_object_path": "/Game/Gloamstead/Generated/Biomes/Sanctuary/1_0_0/hero-ritual/veil_heart_restored.veil_heart_restored",
      "dependency_ids": [
        "mi-sanctuary-restored"
      ],
      "acceptance_tags": [
        "hero-silhouette",
        "state-readability",
        "collision",
        "lod"
      ],
      "ownership": {
        "owner": "Gloamstead",
        "license": "Proprietary-Gloamstead"
      },
      "asset_family_lane": "hero-ritual",